{
  "name": "Gräddtårta",
  "description": "A simple template for creating a recipe",
  "portions": 1,
  "ingredients": [{ "id": "id", "name": "name", "unit": "st" }],
  "resources": [{ "id": "ugn", "name": "Ugn" }],
  "tasks": [
    {
      "id": "id",
      "name": "name",
      "instructions": "instructions",
      "passive": false,
      "nonInterruptable": false,
      "initalTask": false,
      "finalTask": false,
      "estimatedTime": 999,
      "ingredients": [{ "ingredientId": "id", "amount": 99 }],
      "resources": [{ "resourceId": "resource", "amount": 99 }]
    },
    {
      "id": "ugnPå",
      "name": "Sätt på ugnen",
      "instructions": "Sätt på ugnen på 175°C.",
      "initalTask": true,
      "estimatedTime": 1,
      "ingredients": [],
      "resources": [{ "resourceId": "ugn", "amount": 1 }]
    }
  ],
  "taskDependencies": [
    {
      "taskId": "id",
      "dependsOn": ["otherID"],
      "strongDependsOn": ["thirdID"]
    }
  ]
}
