{
  "name": "template",
  "description": "A simple template for creating a recipe",
  "portions": 1,
  "ingredients": [{ "id": "ingredient", "name": "name", "unit": "st" }],
  "resources": [{ "id": "resource", "name": "name" }],
  "tasks": [
    {
      "id": "id",
      "name": "name",
      "instructions": "instructions",
      "passive": false,
      "nonInterruptable": false,
      "initalTask": false,
      "finalTask": true,
      "estimatedTime": 999,
      "ingredients": [{ "ingredientId": "ingredient", "amount": 99 }],
      "resources": [{ "resourceId": "resource", "amount": 99 }]
    },
    {
      "id": "otherID",
      "name": "otherName",
      "instructions": "More instructions",
      "estimatedTime": 999,
      "ingredients": [{ "ingredientId": "ingredient", "amount": 99 }],
      "resources": [{ "resourceId": "resource", "amount": 99 }]
    }
  ],
  "taskDependencies": [
    {
      "taskId": "id",
      "dependsOn": ["otherID"],
      "strongDependsOn": ["thirdID"]
    }
  ]
}
